{
  "schemaVersion": 1,
  "manifestId": "mrid6-23-v39-2026-08",
  "deviceFamily": "Jiaolong16Pro2023",
  "boardProductsExact": ["MRID6-23"],
  "biosVersionsExact": ["MRID6_23_P_V39"],
  "cpu": { "vendor": "AuthenticAMD", "modelContains": "AMD Ryzen 7 7745HX" },
  "gpus": [{ "vendorId": "10DE", "pnpDeviceIdsExact": ["PCI\\VEN_10DE&DEV_2820&SUBSYS_13031D05&REV_A1\\4&D0BDF66&0&0009"], "nameContains": "RTX 4070 Laptop GPU" }],
  "wmiProvider": { "namespace": "root\\WMI", "class": "MICommonInterface", "instanceName": "ACPI\\PNP0C14\\MIFS_0", "readType": 250, "writeType": 251 },
  "dependencies": [{ "name": "PawnIO", "version": "2.2.0.0", "publisher": "namazso", "sha256": "FCA6E7D58B0CF38DBB913A2B9E532F48629145D395F454B16A9F58E97B8D3940" }],
  "safety": { "cpuCriticalC": 95, "gpuCriticalC": 87, "circuitFailures": 3, "circuitBreakSeconds": 60 },
  "capabilities": [
    { "key": "performanceMode", "state": "available" },
    { "key": "muxMode", "state": "available" },
    { "key": "cpuTuning", "state": "available" },
    { "key": "cpuTuning:curveOptimizer", "state": "available" },
    { "key": "cpuTuning:smu", "state": "available" },
    { "key": "cpuTuning:pbo", "state": "available" },
    { "key": "fanControl", "state": "available" },
    { "key": "strongCooling", "state": "available" },
    { "key": "keyboardLighting", "state": "available" },
    { "key": "gpuVfCurve", "state": "available" },
    { "key": "gpuMemoryOffset", "state": "available" },
    { "key": "gpuCoreOffset", "state": "available" },
    { "key": "gpuFrequencyLimit", "state": "available" },
    { "key": "gpuVoltageBoost", "state": "available" },
    { "key": "gpuPowerLimit", "state": "available" },
    { "key": "quickSetting:wifi", "state": "available" },
    { "key": "quickSetting:bluetooth", "state": "available" },
    { "key": "quickSetting:touchpad", "state": "available" },
    { "key": "quickSetting:fnLock", "state": "available" },
    { "key": "quickSetting:lidLogo", "state": "available" }
  ],
  "migration": { "semanticKeys": [], "forbiddenLowLevelKeys": ["methodName", "ecAddress", "rawPayload"] }
}
